{
  "id": "operability.control-harness",
  "status": "experimental",
  "version": "0.1.0",
  "owner": "cli",
  "targets": [
    "native-headless"
  ],
  "contracts": [
    "contracts/control-protocol.schema.json",
    "schemas/scenario.schema.json",
    "contracts/run-manifest.schema.json",
    "contracts/ui-inspection-projector.schema.json",
    "contracts/ui-view-model.schema.json",
    "contracts/rendered-ui-snapshot.schema.json"
  ],
  "examples": [
    "examples/first-game/scenarios/charge-core.jsonc"
  ],
  "dependencies": [
    "runtime.lua-gameplay",
    "presentation.readonly-projectors",
    "runtime.save-replay"
  ],
  "verification": [
    "pnpm test:cli",
    "pnpm test:harness",
    "pnpm test:cold-session"
  ],
  "limitations": [
    {
      "code": "HARNESS_HEADLESS_CAPTURE_IS_SEMANTIC",
      "message": "The headless adapter captures deterministic SVG for composition and semantics; pixel evidence requires game capture --raster, which renders through the ElectronHost."
    },
    {
      "code": "HARNESS_RASTER_REQUIRES_DESKTOP_SESSION",
      "message": "Raster capture needs an installed Electron and a graphical session; headless Linux runners require a virtual display."
    },
    {
      "code": "HARNESS_RENDERER_CODES_GENERIC",
      "message": "Host diagnostics carry dedicated codes for script errors, rejected promises, missing assets, lost WebGL contexts and audio failures; renderer and shader problems still surface as script errors."
    },
    {
      "code": "HARNESS_COMMAND_TRACE_DERIVED",
      "message": "Command-stage traces report committed state diffs and do not expose private Lua instructions."
    }
  ]
}
