{
  "id": "network.loopback-room",
  "status": "experimental",
  "version": "0.1.0",
  "owner": "kernel",
  "targets": ["native-headless"],
  "contracts": [
    "kernel/src/network_session.hpp",
    "docs/adr/0024-player-hosted-multiplayer-and-protocol-compatibility.md",
    "docs/adr/0038-network-transport-adapters.md"
  ],
  "examples": [
    "tests/kernel/kernel_test.cpp"
  ],
  "dependencies": ["runtime.save-replay", "spatial.region-storage"],
  "verification": [
    "pnpm test:native"
  ],
  "limitations": [
    {
      "code": "NETWORK_EXTERNAL_TRANSPORT_UNAVAILABLE",
      "message": "O protocolo lógico só possui adapter loopback. WebRTC DataChannel e Steam Networking continuam indisponíveis até seus boundaries declarados."
    }
  ]
}
