{
  "id": "runtime.lua-gameplay",
  "status": "experimental",
  "version": "0.2.0",
  "owner": "kernel",
  "targets": ["native-headless", "browser", "electron"],
  "contracts": [
    "runtime-c-api/include/ludivra/runtime.h",
    "contracts/lua-sdk-v1.json"
  ],
  "examples": ["examples/first-game", "examples/card-roguelite"],
  "dependencies": [],
  "verification": [
    "pnpm contracts",
    "pnpm test:native",
    "pnpm test:wasm-equivalence",
    "pnpm test:card-roguelite"
  ],
  "limitations": [
    {
      "code": "LUA_API_EXPERIMENTAL",
      "message": "The Lua API remains experimental until two materially different games prove its reusable surface."
    }
  ]
}
