{
  "id": "authoring.asset-cooker",
  "status": "experimental",
  "version": "0.1.0",
  "owner": "cli",
  "targets": ["browser", "electron", "native-headless"],
  "contracts": [
    "schemas/game.schema.json",
    "cli/src/project.ts",
    "cli/src/asset-forge.ts",
    "cli/src/commands/build.ts",
    "presentation-protocol/src/index.ts",
    "renderer-three/src/index.ts",
    "hosts/browser/vite.config.ts",
    "docs/adr/0049-asset-ingest-cooking-and-residency.md"
  ],
  "examples": [
    "examples/first-game/game.jsonc",
    "examples/first-game/assets/models/reference-triangle.gltf",
    "cli/test/cli.test.mjs"
  ],
  "dependencies": ["presentation.three"],
  "verification": [
    "pnpm --filter @ludivra/cli test",
    "pnpm game asset cook --project examples/first-game --format json",
    "pnpm game validate --project examples/first-game --format json"
  ],
  "limitations": [
    {
      "code": "ASSET_TARGET_VARIANT_MISSING",
      "message": "Browser/Electron carregam modelos glTF/GLB cozidos por URL estática, mas encoder/compressão, variantes por target, rewriting de dependências externas, residência e streaming ainda não existem."
    }
  ]
}
