{
  "id": "mass.reference-runtime",
  "status": "experimental",
  "version": "0.1.0",
  "owner": "kernel",
  "targets": ["native-headless"],
  "contracts": ["schemas/mass-population.schema.json", "kernel/src/mass_reference.hpp"],
  "examples": ["examples/card-roguelite/mass/ember-vault.mass.jsonc", "tests/kernel/kernel_test.cpp"],
  "dependencies": ["spatial.regional-world"],
  "verification": ["pnpm test:native", "pnpm game validate --project examples/card-roguelite --format json", "pnpm test:card-roguelite"],
  "limitations": [
    { "code": "MASS_SAVE_UNAVAILABLE", "message": "Os arrays autoritativos ainda não são persistidos porque region storage pertence à Fase 7." },
    { "code": "MASS_PRESENTATION_BUFFER_UNAVAILABLE", "message": "Níveis visuais e de densidade não emitem o buffer de instancing até o renderer escalável da Fase 8." }
  ]
}
